{
  "schema": "agent-readiness/report@1",
  "repo": "monorepo-mixed",
  "audit": {
    "id": "aud-2026-10-27-7070f44-e101",
    "date": "2026-10-27",
    "commit": "7070f44",
    "dirtyTree": false,
    "rubric": "2026-10-alpha",
    "tier": "local-exec",
    "scriptsDigest": "0d6fcaa4e37e814b5741a3b87bb097360242d52f8c08e4ba3dd9a9756ad4a519",
    "seedPinned": true,
    "sealStatus": "Scripts match the agent-readiness-v0.1.0 manifest bundled with this copy; the published release isn't checked here",
    "staleCopy": null,
    "previous": null,
    "storedAt": ".agent-readiness/history/audits/aud-2026-10-27-7070f44-e101"
  },
  "scale": [
    {
      "level": 0,
      "name": "Not bootable",
      "plain": "not bootable",
      "meaning": "A clean checkout can't install, build and pass its tests.",
      "measuredBy": "audit"
    },
    {
      "level": 1,
      "name": "Bootable",
      "plain": "bootable",
      "meaning": "A clean checkout installs, builds and passes every test.",
      "measuredBy": "audit"
    },
    {
      "level": 2,
      "name": "Verifiable",
      "plain": "verifiable",
      "meaning": "Agents can check their own work: the commands pass, the tests catch planted faults, the instructions are accurate and normal work needs no production access.",
      "measuredBy": "audit"
    },
    {
      "level": 3,
      "name": "Delegable",
      "plain": "delegable",
      "meaning": "Agent PRs meet the outcome targets your team set.",
      "measuredBy": "outcomes"
    },
    {
      "level": 4,
      "name": "Scalable",
      "plain": "scalable",
      "meaning": "Those targets held while agent PR volume at least doubled.",
      "measuredBy": "outcomes"
    }
  ],
  "scenarios": [],
  "maturity": {
    "level": 0,
    "rule": "The repo level is the lowest level among active components, the assessed components with at least 10% of changes over 90 days; a component joins or leaves that set only after two audits on the same side of the line, and components the audit can't assess never set it.",
    "couldBe": null,
    "couldBeReason": null,
    "setBy": [
      "api"
    ],
    "partialCoverage": false,
    "assessedComponents": 3,
    "outcome": "proven",
    "confidence": {
      "level": "high",
      "reasons": [
        "every check that decides the level ran"
      ]
    },
    "capReasons": [
      {
        "component": "api",
        "condition": "clean.test",
        "label": "passes every test in a clean container",
        "state": "not_met",
        "reason": "test failed: connection refused on port 5432 (1 of 1 tests failed)"
      }
    ],
    "unproven": false,
    "next": {
      "level": 1,
      "name": "Bootable",
      "met": [],
      "unmet": []
    }
  },
  "components": {
    "shape": "monorepo",
    "included": [
      {
        "id": "api",
        "path": "packages/api",
        "toolchain": "Node",
        "manifest": "packages/api/package.json",
        "lockfile": null,
        "changeShare": 0.56,
        "active": true,
        "level": 0,
        "couldBe": null,
        "unproven": false,
        "capReasons": [
          {
            "component": "api",
            "condition": "clean.test",
            "label": "passes every test in a clean container",
            "state": "not_met",
            "reason": "test failed: connection refused on port 5432 (1 of 1 tests failed)"
          }
        ],
        "scenarios": []
      },
      {
        "id": "shared",
        "path": "packages/shared",
        "toolchain": "Node",
        "manifest": "packages/shared/package.json",
        "lockfile": null,
        "changeShare": 0.15,
        "active": true,
        "level": 1,
        "couldBe": null,
        "unproven": false,
        "capReasons": [
          {
            "component": "shared",
            "condition": "instructions",
            "label": "agent instructions are accurate",
            "state": "not_met",
            "reason": "3 of 7 instruction items are wrong"
          }
        ],
        "scenarios": []
      },
      {
        "id": "worker",
        "path": "packages/worker",
        "toolchain": "Node",
        "manifest": "packages/worker/package.json",
        "lockfile": null,
        "changeShare": 0.27,
        "active": true,
        "level": 1,
        "couldBe": null,
        "unproven": false,
        "capReasons": [
          {
            "component": "worker",
            "condition": "faults",
            "label": "tests catch planted faults",
            "state": "not_met",
            "reason": "caught 0 of 5 planted faults; missed: change_constant at packages/worker/src/retry.js:2, change_constant at packages/worker/src/retry.js:9, change_constant at packages/worker/src/retry.js:3, change_constant at packages/worker/src/retry.js:12, change_constant at packages/worker/src/retry.js:5"
          },
          {
            "component": "worker",
            "condition": "instructions",
            "label": "agent instructions are accurate",
            "state": "not_met",
            "reason": "3 of 7 instruction items are wrong"
          }
        ],
        "scenarios": []
      }
    ],
    "excluded": [
      {
        "id": "infra",
        "path": "infra",
        "toolchain": "Terraform",
        "manifest": null,
        "lockfile": null,
        "changeShare": 0.02,
        "reason": "Terraform isn't supported by this rubric"
      }
    ]
  },
  "executive": {
    "heading": "Level 0 of 4, not bootable",
    "headline": "Agents can't pass the tests in api from a clean checkout because its tests need Postgres running, which the setup doesn't start, and 56% of recent changes land there.",
    "numbers": [
      {
        "label": "Components ready for agents",
        "value": "0 of 3",
        "comparison": "Level 2 needs 3 of 3"
      },
      {
        "label": "Agent PRs that pass CI the first time",
        "value": "33% (3 of 9)",
        "comparison": "Other PRs: 71% (29 of 41), Sep 27 to Oct 27, 2026"
      },
      {
        "label": "Recent changes in components below Level 1",
        "value": "56%",
        "comparison": "Level 1 needs 0%, counting the last 90 days"
      }
    ],
    "nextLine": "Next: Level 1, bootable. Met: installs from the lockfile in a clean container. Not yet: api passes every test in a clean container.",
    "gaps": [
      {
        "rank": 1,
        "text": "Set up Postgres for agents in api",
        "blocks": "Blocks Level 1 for api",
        "itemId": "clean.test:api"
      },
      {
        "rank": 2,
        "text": "Fix the stale agent instructions",
        "blocks": "Blocks Level 2 for shared",
        "itemId": "instructions:repo"
      },
      {
        "rank": 3,
        "text": "Make worker's tests catch wrong behavior",
        "blocks": "Blocks Level 2 for shared",
        "itemId": "faults:worker"
      }
    ],
    "ask": "Decision needed: approve committing the setup files. Also name an owner for agent readiness.",
    "coverage": "The level covers 3 components and ignores infra (2% of changes, Terraform isn't supported by this rubric). Agent PRs are matched by head branch starting with cursor/.",
    "noBlocker": false
  },
  "actions": [
    {
      "rank": 1,
      "itemId": "clean.test:api",
      "title": "Set up Postgres for agents in api",
      "startNow": false,
      "why": "In a clean container, api's tests fail because nothing starts Postgres: connection refused on port 5432.",
      "movesTheNeedle": "Takes api to Level 1, covering 56% of recent changes. Agents can run api's checks before they push, so fewer agent PRs fail CI the first time.",
      "watch": "Share of agent PRs touching api that pass CI the first time. Now: 20% (1 of 5), Sep 27 to Oct 27, 2026.",
      "research": "In the BootstrapAgent study, a reusable, verified setup cut later agents' token use by 25.9% and build time by 22.3%. Measured on the study's benchmark repositories. https://arxiv.org/abs/2605.15815",
      "effortAndOwner": "Small: setup scripts and environment config, no source changes. Repo maintainer.",
      "decision": "Approve committing the setup files",
      "doneWhen": "`readiness replay --component api` passes every test.",
      "dependsOn": [],
      "impact": 0.56,
      "effort": "small"
    },
    {
      "rank": 2,
      "itemId": "instructions:repo",
      "title": "Fix the stale agent instructions",
      "startNow": false,
      "why": "3 instructions agents would follow are wrong: npm run changelog (no \"changelog\" script in package.json), pnpm test (uses pnpm, but the repo uses npm).",
      "movesTheNeedle": "Takes shared to Level 2, covering 15% of recent changes. Agents stop following stale steps, such as running pnpm in a repo that doesn't use it.",
      "watch": "Agent PRs that add a stray pnpm-lock.yaml. Now: 11% (1 of 9), Sep 27 to Oct 27, 2026.",
      "research": null,
      "effortAndOwner": "Small: 2 instruction files. Repo maintainer.",
      "decision": null,
      "doneWhen": "`readiness run --instructions` replays every instruction item.",
      "dependsOn": [],
      "impact": 0.15,
      "effort": "small"
    },
    {
      "rank": 3,
      "itemId": "faults:worker",
      "title": "Make worker's tests catch wrong behavior",
      "startNow": false,
      "why": "The audit planted 5 faults in worker in a throwaway copy, and the tests caught 0.",
      "movesTheNeedle": "Changes no level on its own: shared to Level 2, worker to Level 2 together with Fix the stale agent instructions. Changes in worker get a real pass-or-fail signal, so reviewers catch less by hand.",
      "watch": "Share of agent PRs touching worker where a reviewer requested changes. Now: 2 of 3 (too few for a rate), Sep 27 to Oct 27, 2026.",
      "research": "In DeployBench, 53.9% of failed runs passed generic checks and failed only task-specific ones. 51 research-artifact deployment tasks. https://deploybench.vercel.app/",